{
  "catalog_version": "v0.0.1",
  "catalog_id": "catalog_2026_02_09",
  "generated_at": "2026-02-08T13:00:00Z",
  "owner_id": "team.platform",
  "workflow_id": "wf.deploy.gated",
  "review_ref": "artifacts/catalog/review-2026-02-09.md",
  "tools": [
    {
      "tool": "cd_pipeline",
      "actions": ["promote_release", "rollback_release"],
      "permissions": ["deploy:write"],
      "data_classes": ["internal"],
      "owner_id": "team.platform",
      "revocation_path": "authz_gateway/revoke?workflow=wf.deploy.gated",
      "logging_location": "logs://authority/cd_pipeline",
      "risk_notes": "R3/R4 actions require approval and preflight."
    },
    {
      "tool": "reports_api",
      "actions": ["generate_report"],
      "permissions": ["reports:read"],
      "data_classes": ["public"],
      "owner_id": "team.analytics",
      "revocation_path": "authz_gateway/revoke?workflow=wf.reporting.readonly",
      "logging_location": "logs://authority/reports_api"
    }
  ]
}
